{
  "$schema": "https://json-schema.org/draft/2020-12/schema",
  "$id": "https://morphy/schemas/catalog.schema.json",
  "title": "Per-state composite catalog",
  "description": "The contract between the Python preprocess pipeline (catalog_builder.build_catalog) and the TypeScript map app (catalog.ts parseCatalog). This file is the single source of truth — both sides must conform.",

  "type": "object",
  "additionalProperties": false,
  "required": [
    "schema_version",
    "state_fips",
    "state_name",
    "state_abbr",
    "generated_at",
    "layers",
    "views",
    "sources_used_versions"
  ],
  "properties": {
    "schema_version": {
      "type": "integer",
      "const": 3,
      "description": "Bumped on incompatible changes. Constant in code (CATALOG_SCHEMA_VERSION in compose.py and Catalog.schemaVersion in catalog.ts)."
    },
    "state_fips": { "type": "string", "minLength": 2, "maxLength": 2, "description": "Two-digit state FIPS." },
    "state_name": { "type": "string", "minLength": 1 },
    "state_abbr": { "type": "string", "minLength": 2, "maxLength": 2 },
    "generated_at": { "type": "string", "description": "ISO 8601 timestamp." },

    "sources_used_versions": {
      "type": "object",
      "description": "source_id -> raw local version string (lineage).",
      "additionalProperties": { "type": "string" }
    },

    "layers": {
      "type": "object",
      "description": "Composite layer name (= OUTPUT_BASENAMES[canonical_type]) -> Layer descriptor.",
      "additionalProperties": { "$ref": "#/$defs/Layer" }
    },

    "views": {
      "type": "object",
      "description": "View name -> View descriptor.",
      "additionalProperties": { "$ref": "#/$defs/View" }
    }
  },

  "$defs": {
    "Layer": {
      "type": "object",
      "additionalProperties": false,
      "required": ["canonical_type", "rows", "parquet_path", "schema"],
      "properties": {
        "canonical_type": {
          "type": "string",
          "description": "One of the canonical-type keys: tower, parcel, distress_overlay, solar_facility, billboard, county_score, etc."
        },
        "rows": { "type": "integer", "minimum": 0 },
        "parquet_path": {
          "type": "string",
          "minLength": 1,
          "description": "Either a file path (e.g. 'towers.parquet') OR a directory name (e.g. 'parcels') when `sharded` is true. Relative to composite/<fips>/."
        },
        "geojson_path": { "type": "string", "minLength": 1 },
        "simplified_geojson_path": { "type": "string", "minLength": 1 },
        "geometry_type": { "type": "string", "description": "Empty string when the layer has no rows or no detectable geometry type." },
        "schema": {
          "type": "object",
          "description": "Column name -> pandas dtype string.",
          "additionalProperties": { "type": "string" }
        },
        "sharded": {
          "type": "boolean",
          "description": "True when parquet_path points to a directory of per-shard parquets (chunked compose, ADR-051). Absent or false for single-file layers."
        },
        "shard_count": {
          "type": "integer",
          "minimum": 0,
          "description": "Number of per-shard parquets when sharded=true. Required when sharded=true; absent otherwise."
        }
      }
    },
    "View": {
      "type": "object",
      "additionalProperties": false,
      "required": ["rows", "geometry_type", "parquet_path", "description", "inputs"],
      "properties": {
        "rows": { "type": "integer", "minimum": 0 },
        "geometry_type": {
          "description": "Geometry type string for spatial views, null for tabular views.",
          "type": ["string", "null"]
        },
        "parquet_path": { "type": "string", "minLength": 1 },
        "geojson_path": { "type": "string", "minLength": 1 },
        "description": { "type": "string" },
        "inputs": {
          "type": "array",
          "items": { "type": "string" },
          "description": "Canonical types the view consumes."
        }
      }
    }
  }
}
